[Loc214] DeviceConnected: Запоминающее устройство для USB

Device Descriptor:
bcdUSB:             0x0210
bDeviceClass:         0x00
bDeviceSubClass:      0x00
bDeviceProtocol:      0x00
bMaxPacketSize0:      0x40 (64)
idVendor:           0x8564
idProduct:          0x1000
bcdDevice:          0x1100
iManufacturer:        0x01
0x0409: "JetFlash"
iProduct:             0x02
0x0409: "Mass Storage Device"
iSerialNumber:        0x03
0x0409: "05BDA0FLXRVTTS4O"
bNumConfigurations:   0x01

ConnectionStatus: DeviceConnected
Current Config Value: 0x01
Device Bus Speed:     High
Device Address:       0x02
Open Pipes:              2

Endpoint Descriptor:
bEndpointAddress:     0x01  OUT
Transfer Type:        Bulk
wMaxPacketSize:     0x0200 (512)
bInterval:            0x00

Endpoint Descriptor:
bEndpointAddress:     0x82  IN
Transfer Type:        Bulk
wMaxPacketSize:     0x0200 (512)
bInterval:            0x00

Configuration Descriptor:
wTotalLength:       0x0020
bNumInterfaces:       0x01
bConfigurationValue:  0x01
iConfiguration:       0x00
bmAttributes:         0x80 (Bus Powered )
MaxPower:             0x96 (300 Ma)

Interface Descriptor:
bInterfaceNumber:     0x00
bAlternateSetting:    0x00
bNumEndpoints:        0x02
bInterfaceClass:      0x08
bInterfaceSubClass:   0x06
bInterfaceProtocol:   0x50
iInterface:           0x00

Endpoint Descriptor:
bEndpointAddress:     0x01  OUT
Transfer Type:        Bulk
wMaxPacketSize:     0x0200 (512)
bInterval:            0x00

Endpoint Descriptor:
bEndpointAddress:     0x82  IN
Transfer Type:        Bulk
wMaxPacketSize:     0x0200 (512)
bInterval:            0x00
